Section,id,Title,N,Kimberling Centers,Year,Video1,Video2,sound,Video3
Multiple Caustics,181,Poncelet Triangles with Smoothly-Varying Circular Caustic: the amazing loci of X(11) and X(59),3,"11,59",2021,https://youtu.be/2VqgB6KvP2g,,T,
Multiple Caustics,182,Bicentrics w/ Two Caustics I: circular locus of X(1),3,"1,3",2021,https://youtu.be/OM7uilfdGgk,,T,
Multiple Caustics,183,"Bicentrics w/ Two Caustics II: circular Loci of X(1), X(40), X(165)",3,"1,3,40,165",2021,https://youtu.be/qJGhf798E-s,,T,
Multiple Caustics,184,"Bicentrics w/ Two Caustics III: sextic loci of X(2), X(4), X(5)",3,"2,3,4,5",2021,https://youtu.be/6Fqp6Z1Q-0A,,T,
Multiple Caustics,185,"Bicentrics w/ Two Caustics IV: loci of X(1) (circle) and X(2) (sextic), varying caustic",3,"1,2,3",2021,https://youtu.be/3dnsWPlAmxE,,T,
Multiple Caustics,186,"Bicentrics w/ Two Caustics V: 1 circle, 2 non-conic loci of the excenters (also: X1,X40 circular)",3,"1,40",2021,https://youtu.be/qdqIuT-Qk6k,,T,
Multiple Caustics,187,Confocals w/ Two Caustics I: locus of the incenter X1 for 4 different caustics,3,1,2021,https://youtu.be/C14TL430UBc,,T,
Multiple Caustics,188,"Bicentrics w/ Three Caustics I: Non-Conic Loci of X1,X2,X6,X8,X10",3,"1,2,6,8,10",2021,https://youtu.be/cvB0A7LmlZc,,T,
Multiple Caustics,189,Bicentrics w/ Three Caustics II -- Non-conic loci of excenters and  incenter,3,1,2021,https://youtu.be/A_-U2VvM5kY,,T,
Multiple Caustics,190,Bicentrics w/ Three Caustics III: loci of incenter & barycenter over 4 possible triangle choices,3,"1,2",2021,https://youtu.be/E1Rcu38MePQ,,T,
Multiple Caustics,191,Bicentrics w/ Three Caustics IV: loci of symmedian & Nagel points over 4 triangle choices,3,"6,8",2021,https://youtu.be/u1_uANWDNr8,,T,
Multiple Caustics,192,Confocals w/ Two Caustics II: locus of the incenter X1 over confocal caustic sweep,3,1,2021,https://youtu.be/kCY6KHFDV2M,,T,
Multiple Caustics,193,"Confocals w/ Two Caustics III: loci of excenters: two elliptic, one non-conic",3,1,2021,https://youtu.be/AisIrfn4IGg,,T,
Multiple Caustics,194,"Confocals w/ Two Caustics IV: two notable loci of the excenters (N=4,6 caustics)",3,1,2021,https://youtu.be/wB9bVkY9rqU,,T,
N-Point Porisms,195,N-Point Porism I: three-point quasi-porisms,"9,18,21",--,2021,https://youtu.be/ui0YmSqR-vI,,T,
N-Point Porisms,196,N-Point Porism II: 3-point chord iteration: porism iff one point lies on mystery ellipse,9,--,2021,https://youtu.be/hvTYkkvhePQ,,T,
N-Point Porisms,197,N-Point Porism III: 3-point chord iteration & elliptic loci of third point for various N,"3,6,9,12,15,18",--,2021,https://youtu.be/a6zoq1YNPrw,,T,
N=3 Loci,198,"Locus of Feuerbach point, its anticomplement and three extouchpoints",3,"1,2,5,11,100",2019,https://youtu.be/TXdg7tUl8lc,https://youtu.be/NNOktM8tvPM,T,https://youtu.be/1gYb5Y3-rQI
N=3 Loci,199,Locus of Excentral and Anticomplementary Triangles and Objects,3,"1,2,5,11,100",2019,https://youtu.be/50dyxWJhfN4,https://youtu.be/xSnRd6WWiKc,,
N=3 Loci,200,3-Periodics and Derived Triangles,3,--,2019,https://youtu.be/xyroRTEVNDc,,,
N=3 Loci,201,Elliptic Loci of X(1) to X(5) and Euler Line,3,"1,2,3,4,5",2019,https://youtu.be/sMcNzcYaqtg,,,
N=3 Loci,202,Locus of several triangular centers is elliptic,3,"1,2,3,4,5",2019,https://youtu.be/f84W2aVnMpU,,,
N=3 Loci,203,Locus of vertices of Feuerbach Triangle is non-elliptic,3,--,2019,https://youtu.be/YPz0_xbit2I,,,
N=3 Loci,204,"Non-Elliptic loci of vertices of Medial, Intouch and Feuerbach triangles",3,"1,5,11",2019,https://youtu.be/OGvCQbYqJyI,,T,
N=3 Loci,205,Locus of Bevan Point X(40) is similar to billiard,3,40,2019,https://youtu.be/NwPioKleiyU,,,
N=3 Loci,206,Locus of Bevan Point X(40) identical to billiard when a/b=golden ratio,3,40,2020,https://youtu.be/rg28gGr-Qeo,,,
N=3 Loci,207,Locus of X(59) has 4 self-intersections,3,59,2020,https://youtu.be/pl_PqSuhlx0,,,
N=3 Loci,208,Anticomplementary triangle intouchpoints,3,"1,2,7,9,100,144",2019,https://youtu.be/NzGKU75-Fuo,https://youtu.be/gwfx6LDJnsE,,
N=3 Loci,209,"Anticomplementary, Medial Triangles and the Intouch Triangle",3,"1,2,7,9,11,100,142,144",2019,https://youtu.be/xyHUwpvAj3g,https://youtu.be/e-mToZlkHtc,,
N=3 Loci,210,The locus of X(140) is a circle over 3-periodics in the Elliptic Billiard,3,"3,5,140",2020,https://youtu.be/4g5G9eluxJo,,T,
N=3 Loci,211,Circular loci for X(140) and X(547) over 3-periodics in the Elliptic Billiard,3,"3,2,5,40,547",2020,https://youtu.be/_umuHLl9cCU,,T,
N=3 Loci,212,I love loci! Classic triangle centers as one vertex moves parallel to the base,3,"1,2,3,4,20",2020,https://youtu.be/Y50RFjhvsAo,,T,
N=3 Loci,213,Triangle family with 2 fixed vertices whose incenter X1 sweeps a circle,3,1,2020,https://youtu.be/MPKt7Q2DhJc,,T,
N=3 Loci,214,"Gallery of Artful, Colorful Triangle Loci. Music by Tchaikovsky",3,--,2021,https://youtu.be/l-O5UT8tpuw,,T,
N=3 Loci,215,"Family of Poncelet Triangles between Concentric, Axis-Parallel Ellipses centered on X(1249)",3,"4,20,1249,1498",2021,https://youtu.be/QQSN_ndDJQk,,T,
N=3 Loci,216,"Loci of Triangle Centers of Poncelet 3-Periodics: 
I Generic Pair, Elliptic Loci",3,"2,3,4,5,20",2021,https://youtu.be/p1medAei_As,,T,
N=3 Loci,217,"Loci of Triangles Centers of Poncelet 3-Periodics II: Pair with Circumcircle, Circular Loci",3,"2,3,4,5,20",2021,https://youtu.be/HXgJQo2UT_8,,T,
N=3 Loci,218,"Loci of Triangle Centers of Poncelet 3-Periodics IV: Outer Elllipse, Inner Non-Concentric Circle",3,"3,5",2021,https://youtu.be/w7sZ5O8k4xU,,T,
N=3 Loci,219,"Poncelet 3-Periodics in a Non-Concentric, Unaligned Ellipse Pair",3,--,2021,https://youtu.be/bjHpXVyXXVc,,T,
N=3 Loci,220,Poncelet 3-Periodics in Generic Pair and Affine Image with Circumcircle (Blaschke Parametrization),3,--,2021,https://youtu.be/6xSFBLWIkTM,,T,
N=3 Loci,221,Elliptic Billiard 3-Periodics: triangle centers whose loci sweep 2 circles and 2 segments,3,"2,3",2021,https://youtu.be/haFTsq5UyK4,,T,
N=3 Loci,222,Loci of Incenter and Excenters over Poncelet 3-Periodics in a Generic Ellipse Pair,3,1,2021,https://youtu.be/z7qDgJEgPVY,,T,
N>3 Periodics,223,4-periodics and Monge's Orthoptic Circle,4,--,2019,https://youtu.be/9fI3iM2jrmI,https://youtu.be/BTSNc_YN0lo,,
N>3 Periodics,224,4-periodics: Loci of Triangle Centers for Vertex Triad,4,--,2019,https://youtu.be/y2bnml8heGg,,,
N>3 Periodics,225,"5-periodics: locus of P1,P2,P3 triangle",5,--,2019,https://youtu.be/yQMOtAGdrqA,,,
N>3 Periodics,226,"5-periodics: locus of P1,P2,P4 triangle",5,--,2019,https://youtu.be/2MA1h-dMnw8,,,
N>3 Periodics,227,5-periodics: Loci of Subtriangles (123 and 124),5,--,2019,https://youtu.be/4lj9yQ-e_cE,,,
N>3 Periodics,228,Upright 5-periodic family,5,--,2019,https://youtu.be/RQE1s2siPSo,,,
N>3 Periodics,229,6-periodic family,6,--,2019,https://youtu.be/YZfFGew4azI,,,
N>3 Periodics,230,Octagramma Mysticum,8,--,2019,https://youtu.be/mDomB-_GiNA,https://youtu.be/xgdgx0erM58,,
N>3 Periodics,231,Enagramma Mysticum: loci of side intersections,9,--,2019,https://youtu.be/ECo1hTCVuDg,,,
N>3 Periodics,232,Mittenpunkt-like Construction of a Stationary Point,4 to 7,--,2019,https://youtu.be/TV2p7fPlYfE,,,
N>3 Periodics,233,Generalized Mittenpunkt and On-Caustic Extouchpoints,"4,5",--,2019,https://youtu.be/Bpc-MrR2IMc,,,
N>3 Periodics,234,Family of Orbits and Their Caustics,3 to 6,--,2019,https://youtu.be/Y3q35DObfZU,,,
N>3 Periodics,235,Ellipse-Inscribed Parallelogram: invariants of the Pedal Polygon w/ respect to boundary points,4,--,2020,https://youtu.be/7eUQQgR-w3c,https://youtu.be/sViggJv4xyQ,T,
N>3 Periodics,236,Elliptic Billiard with Perpendicular Reflection Rule,n/a,--,2020,https://youtu.be/0Qqi7ubS9Bw,,T,
N>3 Periodics,237,Invariant Area Ratios to Minimum-Area Steiner Pedal Polygons,5,--,2020,https://youtu.be/f0JwRlu7iaY,,T,
N>3 Periodics,238,Circumcircles of Focus with Consecutive Vertices Homothetic to Focus Antipedal,"5,6",--,2020,https://youtu.be/kVxh5jfZb9Q,,T,
N>3 Periodics,239,Incenters of Focus Triads: Invariant Area Ratio to N-Periodic and Elliptic Locus,5,--,2020,https://youtu.be/ehnbRnCUmS0,,T,
N>3 Periodics,240,An Invariant Based on Inradii and Circumradii of Subtriangles in the Elliptic Billiard,5,--,2020,https://youtu.be/ipOEfbxWsdk,,T,
N>3 Periodics,241,Cremona-Inversive Polygon of Odd-N-Periodics in the Elliptic Billiard: Zero Signed Area,5,--,2020,https://youtu.be/GrDh0mmtHCE,,T,
N>3 Periodics,242,Family of Poncelet 7-Periodics Interscribed Between Two Ellipses in General Position,7,--,2021,https://youtu.be/kzxf7ZgJ5Hw,,T,
N>3 Periodics,243,N-Periodics in the Elliptic Billiard: Invariant Sum of Cosines,"3,4,5,6,7,8",--,2021,https://youtu.be/qP67bdqS3nQ,,T,
N>3 Periodics,244,N-Periodics in the Homothetic Pair: Invariant Sum of Cotangents,"3,4,5,6,7,8",--,2021,https://youtu.be/TzKsr-x1KFk,,T,
N>3 Periodics,245,Invariant Sums of Generalized Exradii (and their inverses) over various Poncelet families,"3,4,5,6,7",--,2021,https://youtu.be/yiGIl-nXXj8,,T,
Original 2011,246,3-Periodic trajectories,3,--,2011,https://youtu.be/9zAr5-nm7mw,https://youtu.be/A7mPzrNJHkA,,https://youtu.be/6yXA0dyWhFY
Original 2011,247,Locus of incenter is elliptic for family of 3-periodics,3,1,2011,https://youtu.be/BBsyM7RnswA,,,
Original 2011,248,Locus of the incircle touchpoints is a higher-order curve,3,1,2011,https://youtu.be/9xU6T7hQMzs,,,
Orthic Phenomena,249,Locus orthic triangle's incenter is a 4-arc ellipse,3,4,2019,https://youtu.be/3qJnwpFkUFQ,,,
Orthic Phenomena,250,"Locus of orthocenter, orthic orthocenter, incenter, and orthic orthic's incenter",3,"1,4",2019,https://youtu.be/HY577AZVi7I,,,
Orthic Phenomena,251,Excentral of Orthic for Acute and Obtuse Triangles,3,4,2019,https://youtu.be/-bLuvICzmqM,,,
Pedal Invariants,252,Concyclic Feet of Focal Pedals and Invariant Product of Sums of Lengths for odd N,"5,6",--,2020,https://youtu.be/OT-xAdbOp8o,,T,
Pedal Invariants,253,Invariant sum of squared altitudes from each focus to tangential polygon sides,"3,4,5,6,7,8",--,2020,https://youtu.be/VUtBRzmbOYU,,T,
Pedal Invariants,254,"Altitude Invariants to N-Periodics and their Tangential Polygons (N=3,4)","3,4",--,2020,https://youtu.be/MvZhWbI6iB8,,T,
Pedal Invariants,255,"Altitude Invariants to N-Periodics and their Tangential Polygons (N=5,6)","5,6",--,2020,https://youtu.be/ZMHLmWXeKrM,,T,
Pedal Invariants,256,Sum of square altitudes from arbitrary point to N-periodic tangents is invariant,5,--,2020,https://youtu.be/RNmHROZNGj8,,T,
Pedal Invariants,257,Pedal polygons from each focus have invariant area product,5,--,2020,https://youtu.be/sw8pJFMV00w,,T,
Pedal Invariants,258,Pedal Polygons for the N-Periodic and its Tangent Polygon: Area Ratio Invariances,"5,6",--,2020,https://youtu.be/6F7Y3UKJzdk,,T,
Pedal Invariants,259,Exploring Amazing Invariants of N-Periodics and their Pedal Polygons,3--12,--,2020,https://youtu.be/2yXbOV7qf7k,,T,
Pedal Invariants,260,Area Invariants of Pedal and Antipedal Polygons,3,--,2020,https://youtu.be/LN623VjeeFQ,,T,
Pedal Invariants,261,Centroid Stationarity (even N),"4,6",--,2020,https://youtu.be/j_GD_g8aIbg,,T,
Pencil of Circles,262,Poncelet in Circle Pencil I: the geometric Flamenco of 5-Periodics with 4 caustics,5,--,2021,https://youtu.be/L5A_S4VQLiw,,T,
Pencil of Circles,263,Poncelet in Circle Pencil II: constant-perimeter polar image of 5-gons wrt to a limiting point (billiard),5,--,2021,https://youtu.be/8dRap3ZWQjQ,,T,
Pencil of Circles,264,Poncelet in Circle Pencil II: The automatically-closing N=4 family (zero limit-polar perimeter),5,--,2021,https://youtu.be/-8CVK18UkM8,,T,
Pencil of Circles,265,Poncelet in Circle Pencil III: The automatically-closing N=6 family (zero limit-polar perimeter),6,--,2021,https://youtu.be/ZTn8oJZ5p3o,,T,
Pencil of Circles,266,Poncelet in Circle Pencil IV: Polar images of all closing permutations have same invariant perimeter,5,--,2021,https://youtu.be/KQyLs1NyYZ0,,T,
Pencil of Circles,267,Inverting a triangle with respect to a pencil of circles,3,"1, 3, 6, 15, 16, 61, 62, 372, 1151, 1152, 3312",2021,https://youtu.be/hmj5Mf7TV_s,,T,
Pencil of Confocals,268,Tangents from a point on boundary to caustics ,--,--,2019,https://youtu.be/mkhhd536_2w,,,
Pencil of Confocals,269,Tangents to caustics from billiard's vertex lie on a single circle,--,--,2019,https://youtu.be/NsZUyDJ6IOs,,,
Pencil of Confocals,270,Loci of tangents to confocals: point traverses entire elliptic boundary,--,--,2019,https://youtu.be/EL4vgcJaktc,,,
Pencil of Confocals,271,Loci of tangents to confocals: point traverses neighborhood of right vertex,--,--,2019,https://youtu.be/J5CA9UJVflI,,,
Pencil of Confocals,272,"Locus of tangents from ellipse: -45,45 degrees starting points",--,--,2019,https://youtu.be/lXhnBksS74E,,,
Pencil of Confocals,273,"Locus of tangents from ellipse: 5,95,-45,45 degrees starting points",--,--,2019,https://youtu.be/Ac0iej_TaEc,,,
Poncelet Family,274,Family of 3-Periodics in Five Poncelet Pairs,"1,2,3,4,9",--,2020,https://youtu.be/8hkeksAsx0E,,T,
Poncelet Family,275,Isodynamic Pedals and Isogonic Antipedals: Equilaterals with Constant Area in the Homothetic Pair,3,"2,13,14,15,16,395,396,5463,5464",2020,https://youtu.be/7qoxAaG8sbk,,T,
Poncelet Family,276,Poncelet Triangle Inscribed in Ellipse and Circumscribed in Circle,3,"1,2,3,4,5,11,100",2019,https://youtu.be/I1BFOXN-EUw,,,
Poncelet Family,277,Poncelet Family of Triangles over the Family of N=3 Caustics,3,"1,2,3,4,5,11,9,100",2019,https://youtu.be/53pCKKd_5qI,,,
Poncelet Family,278,Pencil of N=3 Poncelet Ellipse Pairs: Loci of Triangular Centers,3,"1,2,3,4,5,6,7,8,9,11,100",2019,https://youtu.be/B5dRXT8Xerw,,,
Poncelet Family,279,Three Geometers Walk into a Bar: the 3-periodic Poncelet-Steiner family has invariant Brocard angle.,3,2,2020,https://youtu.be/2fvGd8wioZY,,T,
Poncelet Family,280,Poncelet Family: Amazing Circular Locus of X3 and the Steiner's Curvature Centroid,5,3,2020,https://youtu.be/601OfxuSDGc,,T,
Poncelet Family,281,5-Periodic Poncelet Families and their Pedal Polygons with Respect to their Curvature Centroids,5,--,2020,https://youtu.be/RP18B827l5I,,T,
Poncelet Family,282,"An N=3 Poncelet family (outer circle, inner ellipse) equivalent to Poristic Excentrals",3,"3,4,5",2020,https://youtu.be/wUu2iMesv3U,,T,
Poncelet Family,283,Between an Ellipse and a Concentric Circle: Poncelet 3-Periodics Identical to Poristic Triangles.,3,"1,3",2020,https://youtu.be/ML_AZoX736w,,T,
Poncelet Family,284,Between a Circle and a Concentric Ellipse: Poncelet 3-Periodics Identical to Poristic Excentrals.,3,"3,4,5",2020,https://youtu.be/xM1SAZO9bDc,,T,
Poncelet Family,285,Jean-Victor Poncelet & Jakob Steiner walk into a Bierhaus + discover many invariants! Prost! Santé!,"3,4,5,6",--,2020,https://youtu.be/30cuWWaZv7A,,T,
Poncelet Family,286,3-Periodics in a Concentric Homothetic Poncelet Pair: Circular Loci of four Triangle Centers,3,"2,13,14,15,16",2020,https://youtu.be/ZwTfwaJJitE,,T,
Poncelet Family,287,3-Periodics in a Homothetic-Rotated Poncelet Pair: stationary orthocenter and loci of X107 and X122,3,"4,107,122",2020,https://youtu.be/fpd_Zot5cKk,,T,
Poncelet Family,288,N-Periodics on a Homothetic-Rotated Poncelet Pair: All Altitudes Meet at the Center!,"3,4,5,6,7",--,2020,https://youtu.be/ttKjzWeG5B8,,T,
Poncelet Family,289,5- and 7-Periodics on a Homothetic-Rotated Poncelet Pair: All Altitudes Meet at the Center,"5,7",--,2020,https://youtu.be/gNHiZvBhKF8,,T,
Poncelet Family,290,Concentric Poncelet Pair w Incircle: Ratio of Sidelength Product to Perimeter is Invariant for odd N,"3,5",--,2020,https://youtu.be/7Jg2nRkkUhQ,,T,
Poncelet Family,291,Concentric Poncelet Pair w Circumcircle: Locus of Pseudo-Orthocenter is Circle (odd N) + Invariants,"3,5",--,2020,https://youtu.be/3f6YBohQCFg,,T,
Poncelet Family,292,"Poncelet Invariants:
circular + point loci of the pseudo-circumcenter and pseudo-orthocenter, N=5,6","5,6",--,2020,https://youtu.be/ZfQEDujbirQ,,T,
Poncelet Family,293,"Poncelet 3-Periodic Invariants (Outer Circle, Inner Concentric Ellipse) of the Nine-Point Center II",3,"3,5,4",2020,https://youtu.be/8xlYaQfQCTw,,T,
Poncelet Family,294,New Invariants of Poncelet N-Periodics in the Homothetic Pair,5,--,2020,https://youtu.be/2PdsC3CcqaE,,T,
Poncelet Family,295,"Concentric Ellipse-Circle Poncelet 3-Periodics: invariant inradius, circumradius and cosine sum",3,"1,3",2021,https://youtu.be/eIxb1so6ORo,,T,
Poncelet Family,296,Power Circles of Poncelet 3-Periodics have Invariant Total Area,3,"2,3,4",2021,https://youtu.be/_psLvzlWTvQ,,T,
Poncelet Family,297,"Limiting Points of Poncelet 3-Periodic Circle Pairs: Loci, Properties, Invariants",3,"1,3,40",2021,https://youtu.be/bHTLS2XzkIQ,,T,
Poncelet Family,298,"Six Families of Poncelet 3-Periodics in Concentric, Axis-Aligned Ellipses",3,"1,2,3,4,6,9",2021,https://youtu.be/14TQ5WlZxUw,,T,
Poncelet Guitar Picks,299,Poncelet Guitar Picks I: Cosine Space of Confocal and Incircle 3-Periodic Families,3,--,2021,https://youtu.be/uwdW95HI-q8,,T,
Poncelet Loci,300,Loci of Triangles Centers of Poncelet 3-Periodics III: Concentric Tilted Ellipse Pair,3,"2,3,4,5,20",2021,https://youtu.be/hpb7ZgKWjUY,,T,
Poncelet Plectra,301,Poncelet 3-Periodics with Incircle and Affine Confocal Image: Identical Invariant Sum of Cosines,3,--,2021,https://youtu.be/CKVoQvErjj4,,T,
Poncelet Plectra,302,Poncelet 3-Periodics w/ Circumcircle and Affine Excentral Image: Identical Invariant Cosine Product,3,--,2021,https://youtu.be/PMqoH4oGt10,,T,
Poncelet Propellers,303,"Poncelet Propellers I: Ellipse Pair with Incircle, Invariant Total Area of Excentral Circumellipses",3,"1,3",2020,https://youtu.be/tHUDfx9o0Wg,,T,
Poncelet Propellers,304,Poncelet Propellers II: invariant total area of anticevian-circumellipse blades,3,"1,2,3,9",2020,https://youtu.be/crXxPJ93ZDk,,T,
Poncelet Propellers,305,Poncelet Propellers III: family of incircle 3-periodics and one excentral circumellipse,3,1,2021,https://youtu.be/JUCmAMsfdkI,,T,
Poncelet Propellers,306,Poncelet Propellers IV: 3 excentral circumellipses and invariant total area,3,1,2021,https://youtu.be/ub4wAv8Hgb0,,T,
Poncelet Propellers,307,Poncelet Propellers V: Total Area Remains Invariant for Non-Axis-Aligned Concentric Ellipse Pair,3,--,2021,https://youtu.be/FJXMpUcslaA,,T,
Poristic,308,Chapple's Porism from (1746) and Weaver (1927) and Odehnal (2011) Invariants,3,"1,3,40,1155",2020,https://youtu.be/DS4ryndDK6Q,,T,
Poristic,309,Circumbilliard of the Poristic Triangle Family: Invariant Aspect Ratio,3,"1,3,9,40",2020,https://youtu.be/yEu2aPiJwQo,,T,
Poristic,310,Poristic Triangle Family and the Amazing Invariant Excentral X3-Centered Inconic,3,"1,3,9,40,100",2020,https://youtu.be/0VHBjdHXbJc,,T,
Poristic,311,"Simson Lines from X100 and Excentral Medials are Parallel to L(X1,X3).",3,"1,3,40,100",2020,https://youtu.be/DfzPrZ0SRRc,,T,
Poristic,312,X1-Centered Circumconic & X40-Centered (Excentral) Inconic: Identical Invariant Axes,3,"1,3,40,100",2020,https://youtu.be/hz0qEyVVvaI,https://youtu.be/PGdQY7f626Y,T,
Poristic,313,Loci of center and foci of the Circumbilliard to the Poristic Family are circles.,3,"1,3,9,40,100",2020,https://youtu.be/LGgh11LMGGY,,T,
Poristic,314,Aspect Ratios of X10- and Excentral X5-Centered Circumconics are Invariant & Equal,3,"1,3,10,40,100",2020,https://youtu.be/-4AAUSFxvmo,,T,
Poristic,315,Invariant aspect ratios for the Circumbilliard and Excentral X6-Ctr Circumconic,3,"1,3,9,40,100",2020,https://youtu.be/Fy4T-dmu-8s,,T,
Poristic,316,Side-by-Side View of Poristic and 3-Periodic Families,3,"1,3,9,40,100",2020,https://youtu.be/NvjrX6XKSFw,,T,
Poristic,317,Feuerbach and Excentral Jerabek Hyperbolas to Poristic Family have invariant focal length ratio,3,"1,3,9,11,100",2020,https://youtu.be/bn1tq6NU_y0,,,
Poristic,318,Reference & Excentral Simson Lines have fixed points and are Orthogonal!,3,"1,3,40",2020,https://youtu.be/M9NIRnfGtGc,https://youtu.be/B06SvYfNByE,T,
Quasi-Porisms,319,Multiple-caustic Poncelet I: a curious N=6 porism,6,--,2021,https://youtu.be/jZQvbzD_DFw,,T,
Quasi-Porisms,320,Multiple-caustic Poncelet II: an N=14 example,"6,14",--,2021,https://youtu.be/wLpLwcmBLms,,T,
Quasi-Porisms,321,Multiple-Caustic Poncelet III: an N=10 example on variant of the bicentric family,10,--,2021,https://youtu.be/iN9RreO6ONA,,T,
Quasi-Porisms,322,Multiple-Caustic Poncelet IV: cases when a pseudo-porism is maintained and cases when it fails,"4,6,8",--,2021,https://youtu.be/XkmyB2uY5XE,,T,
Quasi-Porisms,323,"Multiple-Caustic Poncelet V: a non-poristic and a quasi-poristic N=4, what is going on?",4,--,2021,https://youtu.be/gqzKEBVEoiE,,T,
Quasi-Porisms,324,Multiple-Caustic Poncelet VI: more quasi-porisms with two circular caustics and round-robin tangents,"4,6,8,10,128",--,2021,https://youtu.be/yypsjCNSYj0,,T,
Rotating Equilaterals,325,Rotating Equilaterals I: cevian triangles with respect to a fixed point on circumcircle,3,"1,2,3,4,5,6, 13,14,15,16,20",2021,https://youtu.be/_QM6yNQ9heU,,T,
Rotating Equilaterals,326,Rotating Equilaterals II: loci of cevian triangle centers post-affine transformation,3,"1,2,3,4,5,6, 13,14,15,16,21",2021,https://youtu.be/f01RPhQS0mQ,,T,
Rotating Equilaterals,327,Rotating Equilaterals III: loci of cevian triangle centers w.r.t. a fixed point on the incircle,3,"1,2,3,4,5,6, 13,14,15,16,22",2021,https://youtu.be/1Xtb0H1S8Z4,,T,
Rotating Equilaterals,328,Rotating Equilaterals IV: loci of cevian triangle centers w.r.t. any point on the plane,3,"1,2,3,4,5,6, 13,14,15,16,23",2021,https://youtu.be/z_hndz19lH4,,T,
Rotating Equilaterals,329,Rotating Equilaterals V: Eversions of the Anticevian triangle w.r.t. a point P on the circumcircle,3,"1,2,3,4,5,6, 13,14,15,16,24",2021,https://youtu.be/aGjKEfAv2V8,,T,
Rotating Equilaterals,330,Rotating Equilaterals VI: The nature of eversions of the anticevian triangle w.r.t. a point P,3,"1,2,3,4,5,6, 13,14,15,16,25",2021,https://youtu.be/hLKLq8eUmsY,,T,
Rotating Equilaterals,331,Rotating Equilaterals VII: Conic locus of X2 of antipedal triangles,3,"1,2,3,4,5,6, 13,14,15,16,26",2021,https://youtu.be/8NBh0H2Vps0,,T,
Rotating Equilaterals,332,"Rotating Equilaterals VIII: Loci of X3,X4,X5 of antipedal triangles",3,"1,2,3,4,5,6, 13,14,15,16,27",2021,https://youtu.be/wiknzClcm4s,,T,
Rotating Equilaterals,333,"Rotating Equilaterals IX: Loci of X6,X13,X14,X15,X16 of antipedal triangles",3,"1,2,3,4,5,6, 13,14,15,16,28",2021,https://youtu.be/RF6Mm65qQgI,,T,
Rotating Equilaterals,334,Rotating Equilaterals X: Two incredible pedal and antipedal loci over Poncelet homothetics,3,"1,2,3,4,5,6, 13,14,15,16,29",2021,https://youtu.be/aRadZgO4n2Q,,T,
Rotating Equilaterals,335,Rotating Equilaterals XI: Loci of triangle centers of pedal triangles,3,"1,2,3,4,5,6, 13,14,15,16,30",2021,https://youtu.be/S2OZLny2Hfo,,T,
Rotating Equilaterals,336,Rotating Equilaterals XII: Loci of triangle centers of antipedal triangles,3,"1,2,3,4,5,6, 13,14,15,16,31",2021,https://youtu.be/m7iqvZFL-o8,,T,
Self-Intersected,337,Self-intersecting 4-periodics (bowtie and tangential polygon),4,--,2020,https://youtu.be/C8W2e6ftfOw,https://youtu.be/cCYxN7ueGV4,,
Self-Intersected,338,Self-intersecting 5-periodics (pentagram),5,--,2019,https://youtu.be/ECe4DptduJY,,,
Self-Intersected,339,Self-intersecting 5-periodics (pentagram): Locus of Internal Intersections,5,--,2019,https://youtu.be/ZaqvmK22pBM,,,
Self-Intersected,340,Elliptic Billiard: Self-Intersected 6-Periodics (type I),6,--,2020,https://youtu.be/fOD85MNrmdQ,,T,
Self-Intersected,341,Elliptic Billiard: Self-Intersected 6-Periodics (type II),6,--,2020,https://youtu.be/gQ-FbSq7wWY,,T,
Self-Intersected,342,Self-Intersected 6-Periodics in the Elliptic Billiard: Invariant Perimeter Focus-Inversive Polygon,6,--,2020,https://youtu.be/7lXwjXj-8YY,,T,
Self-Intersected,343,Elliptic Billiard 8-Periodics: Null sum of double cosines of outer polygon,8,--,2020,https://youtu.be/GEmV_U4eRIE,,,
Self-Intersected,344,Family of Self-Intersecting 4-Periodics in the Elliptic Billiard: Inversive Polygon is a Segment,4,--,2020,https://youtu.be/207Ta31Pl9I,,T,
Self-Intersected,345,Type II Self-Intersected 8-Periodics in the Elliptic Billiard + Outer & Inversive Polygons,8,--,2020,https://youtu.be/93xpGnDxyi0,,T,
Self-Intersected,346,Type I Self-Intersected 8-Periodics in the Elliptic Billiard and the Inversive Polygon,8,--,2020,https://youtu.be/5Lt9atsZhRs,,T,
Self-Intersected,347,"Elliptic Billiard Self-Intersected 7-Periodics, a/b=2: Invariant Perimeter Focus-Inversive Polygons",7,--,2020,https://youtu.be/gf_aHyvbqOY,,T,
Self-Intersected,348,Family of self-intersected N=8 w/ turning number 2 in the Elliptic Billiiard,8,--,2020,https://youtu.be/JwD_w5ecPYs,,T,
Self-Intersected,349,The two types of self-intersected 7-periodics in the Elliptic Billiard,7,--,2020,https://youtu.be/yzBG8rgPUP4,,T,
Self-Intersected,350,Elliptic Billiard: Vertices of Self-Intersected 4-Periodics & Outer Polygon are concyclic w/ foci,4,--,2020,https://youtu.be/4g-JBshX10U,,T,
Self-Intersected,351,Self-Intersected Four Periodics in the Elliptic Billiard: Chockfull of Properties,4,--,2021,https://youtu.be/GZCrek7RTpQ,,T,
Stationary Circles,352,Cosine Circle of Excentral Triangle is Stationary,3,"9,40",2019,https://youtu.be/ACinCf-D_Ok,,,
Stationary Circles,353,Locus of Intersection of Anti-Tangents is Stationary Circle,3,9,2019,https://youtu.be/CrOSI8d8qDc,,,
Stationary Circles,354,Intersections of Excentral Triangle and its Reflection is a Circle,3,9,2019,https://youtu.be/hCQIT6_XhaQ,,,
Stationary Circles,355,5-periodics and a stationary circle,5,--,2019,https://youtu.be/dINE4aH1cvk,,,
Stationary Circles,356,Stationary circles for N=3 to 8,3 to 8,--,2019,https://youtu.be/EFeINGIDFrg,,,
Steiner's Hat,357,Equal sum of distances from each focus to vertices of antipedal polygon,"3,4,5,6",--,2020,https://youtu.be/UzBt4R1jGYE,,T,
Steiner's Hat,358,Pedal Polygons to N-Periodics with respect to a Focus: Concyclic Vertices and Circular Caustic,"3,4,5,6",--,2020,https://youtu.be/7TE3a5vEWuU,,T,
Steiner's Hat,359,The Envelope of Ellipse Antipedals is a Constant-Area Deltoid,n/a,--,2020,https://youtu.be/wetmchfY5jI,https://youtu.be/_SuGYRS43EU,T,
