Section,id,Title,N,Kimberling Centers,Year,Video1,Video2,sound,Video3
Steiner's Hat,360,A narrated tour of the Garcia Deltoid: Surprising Invariants and Properties,n/a,--,2020,https://youtu.be/LxADeM1-WHw,,T,
Steiner's Hat,361,Properties of Osculating Circles to the Ellipse at the 3 Cusp Pre-Images,n/a,--,2020,https://youtu.be/NwXc-Vfjs98,,T,
Steiner's Hat,362,Locus of Cusps and Deltoid Center of Area,n/a,--,2020,https://youtu.be/rZht21KFXk4,,T,
Steiner's Hat,363,"Concyclic pre-images, osculating circles, and 3 area-invariant triangles",n/a,--,2020,https://youtu.be/fwyr6LXFS1c,,T,
Steiner's Hat,364,Rotated Negative Pedal Curve of Ellipse is Area-Invariant,n/a,--,2020,https://youtu.be/DgADxkqlKSw,,T,
Subtris,365,"Triangulation-Independent Kimberling Centers of Mass (S. Tabachikov & E. Tsukerman, 2015)",5,--,2021,https://youtu.be/aAqGkNsFKaM,,T,
Subtris,366,Sub-Orthocenter Triangle I: Same Area as Reference!,3,4,2021,https://youtu.be/SZxeu5YIWpQ,,T,
Subtris,367,Sub-Orthocenter Triangle II: Invariant Perimeter over Circumcircle,3,4,2021,https://youtu.be/GXwuDV0fdoU,,T,
Subtris,368,"Dynamics of the ""Circumcenter Map"": Periodicity, Stability, Converging, and Diverging Zones",3,3,2021,https://youtu.be/y6F8SmA67pw,,T,
Subtris,369,GPU-based Visualization of Convergence and Divergence Zones of the Circumcenter Map,3,3,2021,https://youtu.be/PaOPmRraQxQ,,T,
Swans,370,Motion of X(88) with respect to collinear X(100) and X(1),3,"1,88,100",2020,https://youtu.be/DaoNJRcf-0E,,,
Swans,371,Dance of the Swans: X(88) and X(162),3,"9,88,162",2020,https://youtu.be/ljGTtA1x-Sk,https://youtu.be/uv_lZSmX9Pk,T,
Tangential Polygon,372,Locus of Vertices of the Excentral Polygon,3 to 6,--,2019,https://youtu.be/kaYWlBTpUPw,,,
Tangential Polygon,373,5-periodics and feet of excenters,5,--,2019,https://youtu.be/PRkhrUNTXd8,,,
Tangential Polygon,374,Locus of meetpoints of Excentral-to-Orbit Perpendiculars,"3,4,5",--,2019,https://youtu.be/NwPioKleiyU,https://youtu.be/JTasf8JKoH0,,https://youtu.be/ugRFxo0l2OI
Tris Enveloping Ellipses,375,90-deg Isosceles Enveloping an Ellipse -- Non-Conic Loci of Vertices and Centroid,3,2,2021,https://youtu.be/-WaEYct_x7U,,T,
Tris Enveloping Ellipses,376,Equilaterals Enveloping an Ellipse I -- Loci of Vertices and Incenter,3,2,2021,https://youtu.be/LBs3VxbMxPc,,T,
Tris Enveloping Ellipses,377,Equilaterals Enveloping an Ellipse II -- Non-Conic Centroid Locus & Astroidal Envelope of Bisectors,3,2,2021,https://youtu.be/sZka-yj8IR4,,T,
Tris Enveloping Ellipses,378,Family of 90-60-30 Right Triangles Enveloping an Ellipse -- Loci of Vertices and Centers X(1)-X(20),3,"1,2,3,4,5,6,7,8,9,10,11,12,13,14,15,16,17,18,19,20",2021,https://youtu.be/7cLPQkVvVQM,,T,
Unrolled 3-Periodics,379,Fixed central billiard,3,--,2020,https://youtu.be/v7CDrOTFDzo,,,
Unrolled 3-Periodics,380,Pin P1 and n1,3,--,2020,https://youtu.be/20fx69L_gnU,,,
Unrolled 3-Periodics,381,Pin P1 at origin,3,--,2020,https://youtu.be/cPDPb7RmXR4,,,
Unrolled 3-Periodics,382,Pin P1 at origin and P1'' vertically above it,3,--,2020,https://youtu.be/uh45MBlOORE,,,